언론사,제목,내용,작성일시,제목_길이,내용_길이,제목_토큰_갯수,내용_토큰_갯수,제목_명사,내용_명사
매일경제,"“최태원·젠슨황 만날까”…날개 단 SK하이닉스 주가, 20만닉스로 훨훨","
 새해 날아오른 반도체株MS 대규모 AI 시설투자 발표젠슨황 CES 기조연설 기대감美 ISM 제조업 지수도 호재        사진 확대    경기도 이천 SK하이닉스 본사. [사진 = 연합뉴스]  마이크로소프트의 대규모 인공지능(AI) 시설투자에 미국 반도체에 이어 한국 반도체 기업들도 큰 폭의 상승세를 보였다. 여기에 젠슨 황 엔비디아 최고경영자(CEO)의 기조연설이 예정된 CES 행사와 미국 공급관리자협회(ISM) 제조업지수 호조도 반도체주 상승에 힘을 보탰다.6일 유가증권시장에서 SK하이닉스는 9.84% 상승한 19만9800원에 마감해 ‘20만닉스’ 복귀를 눈앞에 두고 있다. 이날 SK하이닉스의 상승폭은 코로나19 셧다운으로 변동성이 극심했던 2020년 3월 24일의 13% 상승 이후 최대폭이다.특히 외국인들은 이날 SK하이닉스를 2조9060억원어치 순매수했다. 새해 들어 3거래일간 외국인은 SK하이닉스를 4조170억원어치 순매수했는데 이는 코스피 순매수 금액 2803억원보다 크다. 같은 기간 삼성전자는 791억원 규모로만 순매수했다. 올 들어 외국인들은 SK하이닉스를 집중 매수하며 현대차 등을 매도하고 있다.이날 삼성전자 역시 2.76% 상승했다.두 반도체 대장주의 상승으로 이날 코스피는 전 거래일 대비 1.91% 오른 2488.64에 장을 마감했다. 코스닥도 독감 관련 제약주와 반도체 소부장(소재·부품·장비)주 상승에 1.73% 올랐다.3일(현지시간) 마이크로소프트가 올해 800억달러의 데이터센터 투자를 발표하자 미국 필라델피아반도체 지수는 2.83% 상승했다. 그동안 빅테크들이 비용 부담 때문에 AI 투자를 확대하기 어렵다는 우려가 컸는데, 마이크로소프트의 공격적 투자 계획이 강력한 수요가 뒷받침하는 AI 투자가 계속 이어진다는 신호가 된 것이다. 이날 엔비디아가 4.45% 오른 것을 비롯해 TSMC는 3.49%, AMD는 3.93% 상승했다.      사진 확대     엔비디아에 고대역폭메모리(HBM)를 납품하는 SK하이닉스뿐만 아니라 관련 밸류체인의 종목들도 동반 상승했다.한미반도체는 6.65% 올랐으며 하나마이크론은 13.27% 상승했다.특히 이날 미국 반도체주들은 7일 개막하는 CES에 대한 기대감에 상승한 것으로 보인다. 한국 증시에서는 그간 잠시 주가가 소강 상태였던 온디바이스AI주의 상승도 두드러졌다. 엔비디아가 AI PC에 들어가는 중앙처리장치(CPU) 진출 관련 발언을 할 수 있다는 가능성 때문이다.이날 에이디테크놀로지(8.71%), 네패스(7.71%) 등이 모두 강하게 반등했다.작년 말 업황 부진에 대한 우려를 반영하며 52주 신저가 수준까지 내려갔던 반도체 소부장은 미국 ISM 제조업지수가 예상보다 호조를 보이자 반등 조건이 마련됐다는 기대가 나온다.PC 등 B2C(기업 대 소비자)와 관련된 반도체들까지 실적 성장으로 이어질 수 있기 때문이다.이은택 KB증권 연구원은 “ISM 제조업지수 반등은 결국 레거시(범용) 반도체의 반등으로 이어진다”고 말했다. 그는 “그동안 반도체 이익을 부정적으로 봤던 외국인 수급도 돌아올 수 있는 요인”이라고 덧붙였다.다만 오랜만의 주가 반등에도 불구하고 여전히 범용 반도체 가격 반등은 나타나지 않아 2거래일간의 주가 상승세가 계속 이어질지는 불확실하다.특히 올해도 D램은 HBM과 범용 시장의 양극화과 예상돼 종목 선별에 더욱 주의를 기울일 필요가 있다.이동주 SK증권 연구원은 “AI 인프라스트럭처 구축 공급망에 포지셔닝돼 있는 업체나 차세대 AI 기술 변화인 3D 패키징, 하이브리드 본딩, ASIC 등에서 기회를 엿볼 수 있는 업체로 선별해 가는 전략이 필요하다”고 조언했다.일부 코스닥 소형주의 경우 사업에 대한 기대감만 있을 뿐 구체적인 이익이 받쳐주지 않고 있어 향후 실적 발표 시즌에 주가가 조정받을 가능성도 크다. 재작년 말 온디바이스AI 테마가 유행이던 때 주가가 급등했던 업종들은 작년 초부터 우하향하며 주가가 반 토막 나기도 했다.
",2025-01-06 20:48:21,39,1937,7,400,최태원 젠슨황 날개 하이닉스 주가 만 닉스,새해 반도체 대규모 시설 투자 발표 젠슨황 연설 대감 제조업 지수 호재 사진 확대 경기도 이천 하이닉스 본사 사진 연합뉴스 마이크로소프트 대규모 인공 지능 시설 투자 미국 반도체 한국 반도체 기업 폭 상승세 여기 젠슨 황 엔비디아 최고경영자 의 연설 예정 행사 미국 공급 관리자 협회 제조업 지수 호조 반도체 주 상승 힘 보탰다 유가 증권 시장 하이닉스 상승 마감 복귀 눈앞 날 하이닉스 상승 폭 코로나 셧다운 변동성 상승 이후 최 대폭 외국인 날 하이닉스 매수 새해 거래 일간 외국인 하이닉스 매수 코스피 매수 금액 기간 전자 규모 로만 매수 외국인 하이닉스 집중 매수 현대차 등 매도 날 삼성 전자 역시 상승 두 반도체 대장 주의 상승 날 코스피 전 거래 일 대비 오른 장 마감 코스닥 독감 관련 약주 반도체 부장 소재 부품 장비 주 상승 현지 시간 마이크로소프트 올해 데이터 센터 투자 발표 미국 필라델피아 반도체 지수 상승 그동안 빅 테크 비용 부담 때문 투자 확대 우려 마이크로소프트 공격 투자 계획 수요 뒷받침 투자가 계속 신호 것 날 엔비디아 오른 것 비롯 상승 사진 확대 엔비디아 대역폭 메모리 를 납품 하이닉스 관련 밸류 체인 종목 동반 상승 한미 반도체 하나마이크론 상승 날 미국 반도체 주 개막 대한 대감 상승 것 한국 증시 그간 잠시 주가 소강 상태 디바이스 주의 상승 엔비디아 중앙 처리장치 진출 관련 발언 수 가능성 때문 날 에이 디 테크놀로지 패스 등 모두 반등 작년 말 업황 부진 대한 우려 반영 주 신저 수준 반도체 부장 미국 제조업 지수 예상 호조 보이 반등 조건 마련 기대 등 기업 소비자 관련 반도체 실적 성장 수 때문 이은택 증권 연구원 제조업 지수 반등 레거시 범용 반도체 반등 고 말 그 그동안 반도체 이익 부정 외국인 수급 수 요인 다만 만 주가 반등 불구 범용 반도체 가격 반등 거래 일간 주가 상승세 계속 올해 램 과 범용 시장 양극화 예상 종목 선별 더욱 주의 필요 이동주 증권 연구원 인프라스트럭처 구축 공급망 포지셔닝 업체 차세대 기술 변화 패키징 하이브리드 본딩 등 기회 수 업체 선 해 전략 고 조언 일부 코스닥 소형 주의 경우 사업 대한 대감 뿐 구체 이익 향후 실적 발표 시즌 주가 조정 가능성 재작년 말 디바이스 테마 유행 때 주가 급등 업종 작년 초 하향 주가 반 토막 나기
매일경제,[단독] “글로벌 큰손 국민연금 이 정도야”…해외 기업에도 제목소리 낸다,"
 올해부터 외국 기업과도 대화적극적으로 주주 의견 제시KCC글라스 조준했던 국민연금공개 주주권행사 또 나설 수도        사진 확대    서울시내의 한 국민연금공단 지사의 모습. [매경DB]  세계적 ‘큰손’인 국민연금이 해외 기업에 대한 투자를 늘리면서 이들 기업에 대한 목소리도 키워가고 있다. 스튜어드십 코드(기관투자자의 적극적 의결권 행사) 강화 기조 아래 의결권 행사와 함께 기타 주주권 행사 활동을 늘려나가는 차원에서다. 지분율이 낮아 상대적으로 활동이 부족했던 해외 기업에 대한 경영 참여를 추진하고, 성별 다양성에 관한 지침도 올해 시행을 앞두고 있다.6일 국민연금 기금운용본부에 따르면 올해부터 해외 기업에 대해서도 ‘기업과의 대화’가 도입된다.현재 국내에서는 6개 중점관리사안(배당정책 수립·임원 보수한도·법령상 위반 우려·지속 반대 의결권·기후변화 관련 위험관리·산업안전 관련 위험관리)과 기타 예상하지 못한 우려 사안이 발생했을 때 서한 발신, 비공개 면담 등의 적극적 주주활동을 벌이고 있다.국민연금이 지분을 5% 이상 보유하거나, 국민연금의 국내 주식 포트폴리오에서 1% 이상을 차지하는 기업이 대상이다. 2023년 기준 172개 기업이다. 이는 2020년 109개에서 63개(57.8%) 늘어난 수치다.그러나 해외 기업은 국민연금이 투자한 액수가 크더라도 지분율이 낮아 기업과의 대화 대상으로 선정된 곳이 사실상 없는 수준이다. 해외 기업은 전쟁·아동노동 등 다양한 ESG(환경·사회·지배구조) 이슈에 노출돼 국내 기업에 적용하는 6개 중점관리사안을 그대로 사용하기도 어렵다.이에 국민연금은 2단계에 걸쳐 해외 기업과의 대화 이행 방안을 마련하고 실효성을 높일 방침이다.      사진 확대     우선 올해와 내년에는 주주활동 용역기관을 통해 대상 기업·주제를 선정해 의견을 제시하고 기업과 미팅을 한다는 계획이다. 또 수탁자책임전문위원회(수책위)에서 우려가 제기될 때에는 이를 전달할 계획이다. 2027년부터는 용역기관을 거치지 않고 국민연금이 직접 국내 기업과 유사한 기업과의 대화를 진행한다.한편 6개 중점관리사안 가운데 기후변화 관련 위험관리, 산업안전 관련 위험관리는 2023년부터 기존 중점관리사안이었던 ‘정기 ESG 평가’로 대체하고 있다.개편 첫해인 2023년에는 두 가지 조항으로 기업과의 대화가 한 건도 이뤄지지 않았는데, 앞으로는 국민연금의 적극적 주주활동을 확대하는 기반이 될 것으로 보인다.기존 평가 체계에서는 비중 있게 다뤄지지 못했던 환경문제 등을 부각시키는 게 개정 이유였던 탓이다. 업계 관계자는 “한국의 ESG는 3개 이슈 가운데 지배구조(G)에 크게 치우친 경향이 있었다”며 “환경(E), 사회(S) 분야 이슈에 관한 국민연금의 주주활동을 늘려야 한다는 지적이 있어 조항을 바꾼 것”이라고 설명했다.국민연금이 올해 공개 주주권 행사에 나설지도 주목된다. 지난해에는 약 7%대 지분율을 가진 KCC글라스가 공개 중점관리 대상에 등재됐다. 국민연금이 경영개선 의견을 공식적으로 밝히고 나선 것은 2년 만이었다. 국민연금은 각종 비공개 조치를 통해 의사를 전달한 뒤에 대화를 거부하거나 개선 여지가 없으면 공개 행보에 나선다.국민연금은 이와 함께 2023년과 2024년 KCC글라스 정기 주주총회에서 2년 연속으로 이사 보수한도 승인 안건에 반대 결정을 내리기도 했다.국민연금이 문제 삼은 것은 KCC글라스의 임원보수한도 적정성이다. 앞서 KCC글라스는 등기이사 5명에게 지급한 보수 총액의 83%를 정몽익 회장에게 지급해 의결권 자문기구로부터 비판을 받은 바 있다.
",2025-01-06 19:28:07,40,1753,9,372,단독 글로벌 큰손 국민연금 정도 해외 기업 목소리,올해 외국 기업 대화 적극 주주 의견 제시 글라스 조준 국민연금 공개 주권 행사 또 수도 사진 확대 서울시 내의 국민연금 공단 지사 모습 매경 세계 큰손 인 국민연금 해외 기업 대한 투자 이 기업 대한 목소리 스튜어드 코드 기관 투자자 적극 의결권 행사 강화 기조 아래 의결권 행사 기타 주권 행사 활동 차원 분율 상대 활동 해외 기업 대한 경영 참여 추진 성별 다양성 관 지침 올해 시행 국민연금 기금 운용 본부 올해 해외 기업 대해 서도 기업 대화 도입 현재 국내 개 중점 관리 사안 배당 정책 수립 임원 보수 한도 법령 위반 우려 지속 반대 의결권 기후변화 관련 위험관리 산업 안전 관련 위험관리 과 기타 예상 못 우려 사안 발생 때 서한 발신 비공개 면담 등 적극 활동 벌이 국민연금 분 이상 보유 거나 국민연금 국내 주식 포트폴리오 이상 차지 기업 대상 기준 개 기업 개 개 수치 해외 기업 국민연금 투자 액수 분율 기업 대화 대상 선정 곳 사실 수준 해외 기업 전쟁 아동노동 등 환경 사회 지배구조 이슈 노출 국내 기업 적용 개 중점 관리 사안 그대로 사용 이 국민연금 단계 해외 기업 대화 이행 방안 마련 실효 방침 사진 확대 우선 올해 내년 주주 활동 용역 기관 통해 대상 기업 주제 선정 의견 제시 기업 미팅 계획 또 탁자 책임 전문 위원회 수책 위 우려 제기 때 전달 계획 용역 기관 거치 국민연금 직접 국내 기업 기업 대화 진행 한편 개 중점 관리 사안 가운데 기후변화 관련 위험관리 산업 안전 관련 위험관리 기존 중점 관리사 정기 평가 로 대체 개편 해인 두 가지 조항 기업 대화 건 앞 국민연금 적극 활동 확대 기반 것 기존 평가 체계 비중 환경문제 등 게 개정 이유 탓 업계 관계자 한국 개 이슈 가운데 지배구조 크게 경향 며 환경 사회 분야 이슈 관 국민연금 활동 지적 조항 것 설명 국민연금 올해 공개 주권 행사 주목 지난해 약 분율 글라스 공개 중점 관리 대상 등재 국민연금 경영 개선 의견 공식 나선 것 만 국민연금 각종 비공개 조치 통해 의사 전달 뒤 대화 거부 거나 개선 여지 공개 행보 국민연금 이 글라스 정기 주주총회 연속 이사 보수 한도 승인 안건 반대 결정 리기 국민연금 문제 삼은 것 글라스 임원 보수 한도 적정 앞서 글라스 등기 이사 명 지급 보수 액 를 정몽 익 회장 지급 의결권 자문 구로 비판 바
한국경제,"한화엔진, 6292억 규모 수주에 신고가 경신","





한화엔진의 주가가 급등하고 있다. 6292억원 규모의 공급계약을 체결했다는 소식에 투자심리가 개선된 것으로 풀이된다.8일 오전 9시10분 현재 한화엔진은 전일 대비 2360원(12.23%) 오른 2만1650원에 거래되고 있다. 주가는 장중 2만3050원까지 치솟으며 52주 신고가를 기록했다.전날 장 마감 후 한화엔진은 6292억원 규모의 선박용 엔진 공급계약을 체결했다고 공시했다. 2023년 연간 매출액의 73.6%에 달한다. 계약기간은 2028년 11월 9일까지다.진영기 한경닷컴 기자 young71@hankyung.com
                                    ",2025.01.08 09:12,25,338,6,54,한화 엔진 억 규모 수주 신고 경신,한화 진의 주가 급등 규모 공급 계약 체결 소식 투자 심리 개선 것 풀이 오전 현재 한화 엔진 전일 대비 오른 거래 주가 장 주 고가 기록 전날 장 마감 후 한화 엔진 규모 선박 용 엔진 공급 계약 체결 공시 연간 매출 액 달 계약 기간 진영 기 한경닷컴 기자
한국경제,4분기 실적 기대치 하회…삼성전자 주가 장 초반 소폭 하락,"




서울 서초구 삼성전자 사옥. 사진=연합뉴스

                8일 삼성전자 주가가 장 초반 소폭 하락하고 있다. 이날 발표한 지난해 4분기 실적이 시장의 기대치를 밑돈 영향으로 풀이된다.이날 오전 9시3분 현재 삼성전자 주가는 전일 대비 0.18% 내린 5만5300원에 거래되고 있다.삼성전자는 이날 개장 전 지난해 4분기 잠정 영업이익 6조5000억원을 기록했다고 공시했다. 당초 증권업계 컨센서스(예상치 평균)였던 8조5000억원을 크게 밑돈 규모다.4분기 실적의 경우 전기 대비 매출은 5.18% 감소, 영업이익은 29.19% 감소했고, 전년 동기 대비 매출은 10.65%, 영업이익은 130.50% 증가했다.삼성전자는 이날 사업부별 실적은 공개하지 않았지만 반도체 사업을 하는 디바이스솔루션(DS) 부문의 4분기 영업이익은 약 3조원 중반대로 직전 분기(3조9000억원) 대비 감소했을 것으로 추산된다. 파운드리·시스템LSI 등 비메모리 분야에서의 적자가 누적되면서 사업부의 전체적인 실적 발목을 잡은 것으로 보인다.주력인 메모리에서도 돌파구를 마련하지 못했다. 중국 메모리업계의 공격적인 가격 정책으로 인해 범용 D램은 지난해 하반기 전반적인 가격 하락세를 겪었으며 이는 수익성에 부정적인 영향을 미친 것으로 추정된다.노정동 한경닷컴 기자 dong2@hankyung.com
                                    ",2025.01.08 09:07,32,710,9,133,분기 실적 기대치 하회 삼성전자 주가 장 초반 소폭 하락,서울 서초구 삼성 전자 사옥 사진 연합뉴스 삼성 전자 주가 장 초반 폭 하락 날 발표 지난해 실적 시장 대치 밑돈 영향 풀이 날 오전 현재 삼성 전자 주가 전일 대비 거래 전자 날 개장 전 지난해 잠정 영업 이익 기록 공시 당초 증권 업계 컨센서스 상치 평균 크게 밑돈 규모 실적 경우 전기 대비 매출 감소 영업 이익 감소 년 동기 대비 매출 영업 이익 증가 전자 날 사업 부별 실적 공개 반도체 사업 디바이스 솔루션 부문 영업 이익 약 중반 직전 분기 대비 감소 것 추산 파운드리 시스템 등 비메 모리 분야 적자 누적 사업 부의 전체 실적 발목 것 주력 메모리 돌파구 마련 중국 메모리 업계 공격 가격 정책 범용 램 지난해 하반기 전반 가격 하락 세 수익 부정 영향 것 추정 노 정동 한경닷컴 기자
