언론사,제목,내용,작성일시,제목_길이,내용_길이,제목_토큰_갯수,내용_토큰_갯수,제목_명사,내용_명사
매일경제,"‘스포츠 구독자 잡자’ 푸보TV, 디즈니 인수 소식에 주가 250% 폭등","
 디즈니, 스포츠스트리밍 사업 확대620만 가입자로 유튜브 추격할 듯증시에선 ‘충성 구독자 유입’ 기대넷플릭스 연말 NFL 중계 시청 인기        사진 확대    6일(현지시간) 푸보TV 주가 흐름  ‘스포츠 스트리밍’ 경쟁에 나선 미국 미디어·콘텐츠 대기업 월트디즈니컴퍼니(이하 디즈니)가 현지 방송 스트리밍 기업 푸보TV를 인수한다고 밝혔다.6일(현지시간) 뉴욕증시에서는 푸보TV 주가가 직전 거래일보다 253.85% 급등해 5.06 달러에 거래를 마친 후 시간 외 거래에서도 20% 가량 올랐다.이날 디즈니는 푸보TV 를 인수해 산하 라이브 스트리밍 서비스 기업인 훌루+라이브TV와 결합한다는 내용의 최종 계약을 체결했다고 발표했다.넷플릭스가 스포츠 중계 콘텐츠로 온라인 스트리밍 서비스를 확장한 가운데 나온 움직임이다.저스틴 워브룩 디즈니 부사장은 “이번 합병으로 훌루+라이브TV와 푸보TV는 소비자에게 더 많은 프로그램 선택권을 더 매력적인 가격대에 지원할 계획”이라고 6일 밝혔다.이어 푸보TV의 강점인 스포츠 중계 서비스와 디즈니의 ESPN 등 네트워크를 결합해 새로운 스포츠 서비스를 만들 것이라고 덧붙였다.데이비드 갠들러 푸보TV 최고경영자(CEO)도 “합병 후 푸보TV와 훌루+라이브TV를 통합한 서비스는 북미 지역에서 총 620만 명의 가입자를 확보하게 될 것이며 60억 달러 이상의 수익를 내게 될 것”이라고 밝혔다.푸보TV는 구글 유튜브TV 경쟁사 중 한 곳으로 꼽힌다.이번 인수 합병을 통해 유튜브TV에 이어 시장 점유율 2위를 차지하게 될 것으로 보인다.푸보TV는 앞서 2015년 축구경기 생중계 스트리밍으로 서비스를 시작했다.이후 종합 스포츠와 뉴스 채널로 확대하면서 가상 다중채널 영상 프로그램 배포(vMVPD) 모델을 도입해 업계 눈길을 끌었다.vMVPD는 스트리밍 플랫폼 한 곳에서 케이블 TV 채널 방송 여러 개를 동시에 제공하는 방식이다.스포츠 중계는 충성 구독자를 끌어모을 수 있다는 점에서 실적을 끌어올릴 만한 사업 영역으로 꼽혀왔고 최근 몇 년 새 업계 진출이 활발하다.일례로 유튜브 측은 지난 2022년 말, 140억달러를 들여 향후 7년간 미국프로풋볼(NFL) 일요 중계권을 따낸 바 있다.작년 5월 온라인 스트리밍업체(OTT) 넷플릭스는 1억5000만달러에 미국프로풋볼(NFL)의 2024~2026년 크리스마스 경기 독점 중계권을 따냈으며, 시청률 조사업체 닐슨 데이터에 따르면 작년 크리스마스 경기를 2400만 여명이 시청한 것으로 알려졌다.지난 달 19일 스위스계 투자은행 UBS 는 넷플릭스가 스포츠 중계 서비스 확장에 나선다면 매출 성장이 두드러질 것이라는 이유를 들어 매수 투자의견을 유지하면서 12개월 목표가를 기존 825달러에서 1040달러로 높였다.한편 미국 방송업계에서는 ‘트럼프 관련주’로 꼽히는 폭스코퍼레이션이 새해 상승세를 잇고 있다.폭스뉴스를 거느린 해당 기업은 6일을 기준으로 올해 들어 주가가 약 1.7% 올랐고 최근 일 년 동안 약 62.5% 상승했다.
",2025-01-07 15:51:26,40,1477,10,313,스포츠 구독자 잡자 푸 디즈니 인수 소식 주가 폭 등,디즈니 스포츠 스트리밍 사업 확대 가입자 유튜브 추격 듯 증시 충성 독자 유입 넷플릭스 연말 중계 시청 인기 사진 확대 현지 시간 보 주가 흐름 스포츠 스트리밍 경쟁 나선 미국 미디어 콘텐츠 대기업 월트디즈니 컴퍼니 이하 디즈니 현지 방송 스트리밍 기업 보 를 인수 고 현지 시간 뉴욕증시 보 주가 직전 거래 일보 급등 달러 거래 후 시간 외 거래 가량 날 디즈니 보 를 인수 라이브 스트리밍 서비스 기업인 훌루 라이브 결합 내용 최종 계약 체결 발표 넷플릭스 스포츠 중계 콘텐츠 온라인 스트리밍 서비스 확장 가운데 움직임 저스틴 워 브룩 디즈니 부사 이번 합병 훌루 라이브 보 소비자 더 프로그램 선택 더 매력 가격 지원 계획 보 의 강점 스포츠 중계 서비스 디즈니 등 네트워크 결 스포츠 서비스 것 데이비드 갠 보 최고경영자 도 합병 후 보 훌루 라이브 를 통합 서비스 북미 지역 총 명의 가입자 확보 것 달러 이상 수익 를 것 보 구글 유튜브 경쟁 사 중 곳 이번 인수 합병 통해 유튜브 시장 점유 율 위 차지 것 보 앞서 축구 경기 생중계 스트리밍 서비스 시작 이후 종합 스포츠 뉴스 채널 확대 가상 다중 채널 영상 프로그램 배포 모델 도입 업계 눈길 스트리밍 플랫폼 곳 케이블 채널 방송 여러 개 동시 제공 방식 스포츠 중계 충성 독자 수 점 실적 만 사업 영역 최근 몇 년 새 업계 진출 일례 유튜브 측은 지난 말 향후 미국 프로 풋볼 일요 중계 바 작년 온라인 스트리밍 업체 넷플릭스 미국 프로 풋볼 의 크리스마스 경기 독점 중계 시청률 조사 업체 닐슨 데이터 작년 크리스마스 경기 여명 시청 것 지난 달 스위스 투자 은행 넷플릭스 스포츠 중계 서비스 확장 매출 성장 것 이유 매수 투자 의견 유지 개월 목표 기존 한편 미국 방송업 트럼프 관련 주 로 폭스 코퍼레이션 새해 상승세 폭스뉴스 거 해당 기업 기준 올해 주가 약 최근 일 년 동안 약 상승
매일경제,"H&Q코리아, ‘미래車 HUD업체’ 티앤에프글로벌에 대규모 투자","
 HUD, 향후 미래 자율주행차 핵심기술티앤에프글로벌 매출 800억·영업익 100억H&Q코리아, 1000억원대 자금 투자        사진 확대    티앤에프글로벌의  Head Up Display(HUD). 운전자 바로 앞 유리창에 그래픽 이미지가 투영된다. <티앤에프글로벌 홈페이지>  국내 주요 PEF(사모펀드)인 H&Q코리아가 오는 2월까지 국내 자동차 부품사 티앤에프글로벌에 대한 대규모 투자에 나선다.7일 IB(투자은행) 업계에 따르면 H&Q코리아는 1000억원대 자금을 투입해 티앤에프글로벌에 대해 대규모 투자에 나선다. 기존에 티앤에프글로벌은 PEF 팍스톤매니지먼트가 만든 티앤에프글로벌홀딩스가 지분 100%를 가지고 있었다. 팍스톤매니지먼트는 지난 2022년 티앤에프글로벌에 약 700억원을 투자한 바 있다.2009년 설립된 티앤에프글로벌은 차량에 장착되는 Head Up Display(HUD)를 생산하는 업체다. 과거 사명은 천호테크였는데, 지난 2019년 차량용 인포테인먼트 중심의 사업 영역을 확대하겠다는 비전을 담으며 티앤에프글로벌로 사명을 변경했다.티앤에프글로벌의 주력상품인 HUD는 차량 주행에 필요한 정보들을 운전자 바로 앞 유리창 부분에 그래픽 이미지로 투영해 주어 운전자가 운전하는 동안 전방의 시선을 유지하면서 계기를 읽을 수 있게 해주는 디스플레이 장치다. LCD 패널, 백라이트유닛(BLU), 반사 렌즈 등으로 구성되며, 주로 운전석 계기판 뒤쪽의 대시보드에 설치된다.최근 전기차 도입 등으로 차량에 장착되는 전장부품이 크게 늘어나면서 HUD는 차량 핵심 부품으로 여겨지고 있다. 향후 자율주행차 등이 도입되면 HUD 수요는 더욱 확대될 전망이다.      사진 확대    티앤에프글로벌 CI  티앤에프글로벌 실적은 최근 몇년 새 꾸준히 증가하고 있다.연결재무제표 기준 티앤에프글로벌 매출은 지난 2018년 382억원서 지난 2023년 842억원으로 증가했다. 같은 기간 영업이익 역시 15억원서 102억원으로 증가했다.H&Q코리아는 이정진, 이종원, 임유철, 김후정 등 4명의 공동대표체재로 운영하는 PEF운용사다.이번 딜을 통해 H&Q코리아는 지난 2020년 10월 조성했던 4호 블라인드 펀드(5000억원)의 소진을 마칠 전망이다.H&Q코리아는 지난 2008년 HL그룹이 만도를 재인수할 당시, HL그룹과 컨소시엄을 맺고 약 750억원을 투자해 2년 후인 2010년 투자원금의 2배에 달하는 1536억원의 수익을 거둔 바 있다. 그 이후 티앤에프글로벌은 H&Q코리아의 역대 두번째 자동차 부품사 포트폴리오가 될 전망이다.
",2025-01-07 15:51:16,35,1268,6,245,코리아 미래 車 업체 티 앤 에프 글로벌 규모 투자,향후 미래 자율 행차 핵심 기술 티앤 에프 글로벌 매출 영업 익 코리아 자금 투자 사진 확대 티앤 에프 글로벌 운전자 바로 앞 유리창 그래픽 이미지 투영 티앤 에프 글로벌 홈페이지 국내 주요 사모펀드 인 코리아 국내 자동차 부품 사 티앤 에프 글로벌 대한 대규모 투자 투자 은행 업계 코리아 자금 투입 티앤 에프 글로벌 대해 대규모 투자 기존 티앤 에프 글로벌 팍 스톤 매니지먼트 티앤 에프 글로벌 홀딩스 분 를 가지 팍 스톤 매니지먼트 지난 티앤 에프 글로벌 약 투자 바 설립 티앤 에프 글로벌 차량 장착 를 생산 업체 과거 사명 호 테크 지난 차량 용 인포테인먼트 중심 사업 영역 확대 티앤 에프 글로벌 사명 변경 티앤 에프 글로벌 주력 상품 차량 주행 정보 운전자 바로 앞 유리창 부분 그래픽 이미지 투영 주어 운전자 운전 동안 전방 시선 유지 계기 수 디스플레이 장치 패널 백라이트 유닛 반사 렌즈 등 구성 주로 운전 석 계기 판 뒤쪽 대시보드 설치 최근 전기차 도입 등 차량 장착 전장 부품 크게 차량 핵심 부품 향후 자율 행차 등 도입 수요 더욱 확대 전망 사진 확대 티앤 에프 글로벌 티앤 에프 글로벌 실적 최근 년 새 증가 연결 재무제표 기준 티앤 에프 글로벌 매출 지난 지난 증가 기간 영업 이익 역시 증가 코리아 이정진 이종원 임 유철 김후정 등 명의 대표 체재 운영 운용 이번 딜 통해 코리아 지난 조성 호 블라인드 펀드 의 소진 전망 코리아 지난 그룹 만도 당시 그룹 컨소시엄 약 투자 후 투자 원금 배 달 수익 바 그 이후 티앤 에프 글로벌 코리아 역대 두번째 자동차 부품 사 포트폴리오 전망
매일경제,코스피 호조에 대장주 ‘사자’ [주식 초고수는 지금],"
 [오후 1시30분 주식 초고수 순매수 동향]현대차·삼성전자 등 시총 상위종목 순매수‘무상증자 중단’ 유한양행도 사들여        사진 확대    현대자동차 울산공장 수출부두에서 해외로 팔려나갈 ‘메이드 인 코리아’ 자동차들이 분주하게 선적되고 있다. 부두를 가로지르는 찬란한 차량 불빛처럼 2025년 새해에는 한국 경제와 기업들에 희망의 빛이 가득하기를 기원해본다.  [울산/이승환 기자]  미래에셋증권에서 거래하는 고수익 투자자들이 7일 오후 가장 많이 순매수한 종목은 현대차, 유한양행, 현대로템, 삼성전자 순으로 집계됐다.      사진 확대    주식 초고수 1월 7일 오후 1시30분 순매수 상위 10종목. [미래에셋증권]  이날 미래에셋증권에 따르면 미래에셋증권 주식 거래 고객 중 최근 1개월간 투자수익률 상위 1%에 해당하는 ‘주식 초고수’들이 오후 1시30분까지 가장 많이 사들인 종목은 현대차다.현대차는 세계 최대 가전·정보기술(IT) 박람회 CES 2025에 참여하진 않지만 주력 전기차인 아이오닉 5를 전시했다. 구글 모회사 알파벳의 자율주행 자회사인 웨이모 부스에서다. 앞서 현대차와 웨이모는 지난해 자율주행 기술 개발을 위해 전략적 파트너십을 체결했다.웨이모는 현재 전 세계적으로 상업적으로 가장 앞선 로보택시를 운영하고 있다. 샌프란시스코와 피닉스 전 지역에서 서비스를 제공하고 있다. 로스앤젤레스와 텍사스주 오스틴 일부 지역에서도 운행을 확대하고 있다.순매수 2위는 유한양행이다. 유한양행은 2017년부터 지난해까지 매년 진행했던 무상증자를 8년 만에 중단할 예정이다. 기존에 공개한 기업가치제고 계획 효과를 높이기 위해서다.무상증자는 기존 주주에 무료로 주식을 지급하는 방식의 주주환원책이다. 기업가치에는 변화가 없으나 권리락 후 주가가 저렴해지는 착시 효과가 발생하면서 주식 매수가 늘고 주가가 오르는 경우가 많다.문제는 무상증자와 자사주 소각이 상충할 수 있다는 점이다. 자사주 소각은 주식 총수를 줄여 기존 주주가 보유하던 주식 가치를 상대적으로 높이는 것이 핵심이다. 무상증자를 통해 주식 총수가 늘면 자사주 소각 효과가 줄어들 수 있다.삼성전자도 순매수 4위에 올랐다. 전날 미국 증시에서 반도체 업종이 강세를 보인 영향으로 풀이된다.엔비디아는 3.43% 상승하며 역대 최고가를 다시 썼고, TSMC와 마이크론테크놀로지는 각각 5.46%, 10.45% 급등했다.특히 엔비디아 협력업체인 대만 폭스콘이 호실적을 발표한 것이 주가 강세에 영향을 줬다. 폭스콘은 AI 서버 수요 증가에 지난해 4분기 매출이 전년 동기 대비 15% 증가했다고 밝혔다.      사진 확대    주식 초고수 1월 7일 오후 1시30분 순매도 상위 10종목. [미래에셋증권]  반면 주식 초고수들이 가장 많이 팔아치운 종목은 한화오션으로 집계됐다. 한화오션 외에도 삼성중공업, HD한국조선해양 등 조선주가 순매도 상위권에 이름을 올렸다.이같은 상승세는 트럼프 미국 대통령 당선인 발언 영향으로 풀이된다. 트럼프 당선인은 6일(현지시간) 한 라디오 프로그램에 출연해 “우리는 선박이 필요하지만 배를 더 이상 만들지 않는다”며 “선박 건조와 관련해 동맹국을 이용할 수 있을 것”이라고 말했다.특히 중국의 선박 건조 상황을 언급하며 “우리(바이든 행정부)는 가만히 앉아서 보고만 있었다”며 “우리(트럼프 행정부)는 해군과 관련해 아주 좋은 것을 발표할 것”이라고 덧붙였다. 또 “독(dock)이 없고 선박 준비가 안 돼 있어 우리가 준비될 때까지 (다른 나라에) 주문을 할 것”이라고 말하기도 했다.
",2025-01-07 15:45:53,29,1743,7,375,코스피 호조 장주 사자 주식 초 고수 지금,오후 주식 초 고수 매수 동향 현대차 삼성 전자 등 총 상위 종목 매수 무상증자 중단 유한양행 사진 확대 현대 자동차 울산 공장 수출 부두 해외 메이드 인 코리아 자동차 선적 부두 차량 불빛 새해 한국 경제 기업 희망 빛 기원 울산 이승환 기자 미래에셋 증권 거래 수익 투자자 오후 가장 매수 종목 현대차 유한양행 현대 로템 삼성 전자 순 집계 사진 확대 주식 초 고수 오후 매수 상위 종목 미래에셋 증권 날 미래에셋 증권 미래에셋 증권 주식 거래 고객 중 최근 개 월간 투자수익률 상위 해당 주식 초 고수 오후 가장 종목 현대차 현대차 세계 최대 가전 정보기술 박람회 참여 주력 전기차 아이오 닉 를 전시 구글 모회사 알파벳 자율 주행 자회사 웨이 모 부스 앞서 현대차 웨이 모 지난해 자율 주행 기술 개발 위해 전략 파트너 체결 웨이 모 현재 전 세계 상업 가장 로보 택시 운영 샌프란시스코 피닉스 전 지역 서비스 제공 로스앤젤레스 텍사스주 오스틴 일부 지역 운행 확대 매수 위 유한양행 유한양행 지난해 매년 진행 무상증자 중단 예정 기존 공개 기업 가치 제 계획 효과 위 무상증자 기존 주주 무료 주식 지급 방식 환원 책 기업 가치 변화 권리 락 후 주가 착시 효과 발생 주식 매수 늘 주가 경우 문제 무상증자 자 사주 소각 상충 수 점 자 사주 소각 주식 총수 기존 주주 보유 주식 가치 상대 것 핵심 무상증자 통해 주식 총수 늘 자 사주 소각 효과 수 전자 매수 위 전날 미국 증시 반도체 업종 강세 영향 풀이 엔비디아 상승 역대 최고 다시 마이크론 테크놀로지 각각 급등 엔비디아 협력 업체 대만 폭스콘 호실 발표 것 주가 강세 영향 폭스콘 서버 수요 증가 지난해 매출 년 동기 대비 증가 사진 확대 주식 초 고수 오후 매도 상위 종목 미래에셋 증권 반면 주식 초 고수 가장 종목 한화 오션 집계 한화 오션 외 삼성 중공업 한국 조선해 등 조선 주가 매도 상위 이름 이 상승세 트럼프 미국 대통령 당선인 발언 영향 풀이 트럼프 당선인 현지 시간 라디오 프로그램 출연 우리 선박 배 더 이상 며 선박 건조 관련 동맹국 이용 수 것 말 중국 선박 건조 상황 언급 우리 바이든 행정부 보고 며 우리 트럼프 행정부 해군 관련 아주 것 발표 것 또 독 이 선박 준비 안 우리 준비 때 다른 나라 주문 것 말
매일경제,"에이프로젠, ℓ당 100g 배양 생산성으로 휴미라 바이오시밀러 임상원료약 생산 ‘성공’","
      사진 확대    [사진제공 = 에이프로젠]  에이프로젠이 AP헬스케어와 휴미라 바이오시밀러 공동사업화에 중요한 진전을 달성했다.국내 바이오시밀러 기업 에이프로젠은 자회사 AP헬스케어와 추진중인 휴미라 바이오시밀러(코드명 AP096)의 공동사업화 중 상업스케일에서 획기적 생산성으로 글로벌 임상시험에 사용될 임상원료약 생산에 성공했다고 7일 밝혔다.에이프로젠의 생산기지인 에이프로젠바이오로직스는 세계 최초로 2000ℓ 배양기를 사용한 퍼퓨전(관류식 연속)배양으로 배양기 ℓ당 100g이라는 놀라운 배양 생산성으로 AP096 임상원료약 생산에 성공했다. 이는 전통적인 배양방식인 페드배치배양 기술을 사용하는 경우 상업스케일 배양생산성이 ℓ당 2g 내외에 불과한 것을 감안하면 놀라운 성취라고 회사측은 설명했다.회사 관계자는 “지난 2016년 자사가 일본에서 상업화에 성공한 GS071은 배양기 ℓ당 생산성이 3g 내외였고 현재 임상3상 단계에 있는 AP063이 ℓ당 65g 내외인 점을 보더라도 이번 AP096 임상시험약 배양 생산성 100g은 대단한 진전”이라며 “임상시험용 의약품은 까다로운 GMP(Good Manufacturing Practice) 규정을 준수해 생산돼야 한다는 점에서도 이번 성과는 에이프로젠바이오로직스의 기술 수준이 빠르게 성장하고 있다는 점을 시사한다”고 말했다.동물세포 배양으로 생산되는 바이오 원료의약품의 경우 연구실 스케일과 상업스케일에서의 생산성에는 큰 차이가 있다. 페드배치배양의 경우 연구실 수준에서는 배양기 ℓ당 최대 10g까지도 생산성 구현이 가능하다는 보고가 있지만 상업스케일의 대규모 생산에서는 ℓ당 최대 수 g에 지나지 않는 것이 현실이다. 이는 배양기가 커지면 커질수록 기술적 난이도가 높아지기 때문이다.살아있는 세포를 배양기 내에 계속 가둬두면서 만들어진 항체만을 계속 밖으로 빼내야 하는 퍼퓨전배양은 배양기 크기뿐만 아니라 항체 생산성에 비례해서 기술적 난이도가 기하급수적으로 높아진다. 배양기가 커지고 항체 농도가 높아지면 세포와 항체를 분리하는 장치에 미치는 부하가 기하급수적으로 커지기 때문이다. 이러한 이유로 오리지널 레미케이드의 경우 퍼퓨전배양으로 생산됐지만 수십대의 200ℓ급 배양기를 사용할 수밖에 없었다.에이프로젠 관계자는 “최근 퍼퓨전 방식으로 상업화된 국내 대기업 제품들과 아일랜드 에보텍의 휴미라 바이오시밀러도 배양기 크기가 1000ℓ를 넘지 못했고 생산성도 에이프로젠 AP096의 몇 분의 일에 불과하다”고 설명했다.이상규 기자
",2025-01-07 15:30:52,48,1238,10,245,이프로 젠 배양 생산 미라 바이오 시 임상 원료 약 생산 성공,사진 확대 사진 제공 에이 프로 젠 에이 프로 젠 헬 스케 미라 바이오 밀러 사업 진전 달성 국내 바이오 밀러 기업 에이 프로 젠 자회사 헬 스케 추진 미라 바이오 밀러 코드명 의 사업 중 상업 스케일 획기 생산 글로벌 임상시험 사용 임 원료 약 생산 에이 프로 젠 생산 지인 에이 프로 젠 바이오 직스 세계 최초 배양기 사용 퍼 퓨전 관류 연속 배양 배양기 당 배양 생산 임 원료 약 생산 전통 배양 방식 페드 배치 배양 기술 사용 경우 상업 스케일 배양 생산 당 내외 것 감안 성취 회사 측은 설명 회사 관계자 지난 자사 일본 상업 은 배양기 당 생산 내외 현재 임 상 단계 이 당 내외 점 보더 이번 임상시험 약 배양 생산 은 진전 라며 임상시험 용 의약품 규정 준수 생산 점 이번 성과 에이 프로 젠 바이오 직스 기술 수준 점 시사 고 말 동물 세포 배양 생산 바이오 원료 의약품 경우 연구실 스케일 상업 스케일 생산 차이 페드 배치 배양 경우 연구실 수준 배양기 당 최대 생산 구현 보고 상업 스케일 대규모 생산 당 최대 수 것 현실 배양기 기술 난이도 때문 세포 배양기 내 계속 면서 항체 계속 밖 빼 내야 퍼 퓨전 배양 배양기 크기 항체 생산 비례 기술 난이도 기하 급수 배양기 항체 농도 세포 항체 분리 장치 부하 기하 급수 때문 이유 리지 널 레미 케이드 경우 퍼 퓨전 배양 생산 대의 급 배양기 사용 수 에이 프로 젠 관계자 최근 퍼 퓨전 방식 상업 국내 대기업 제품 아일랜드 에보텍 미라 바이오 밀러 배양기 크기 를 생산 성도 에이 프로 젠 의 몇 분 일 고 설명 이상규 기자
