언론사,제목,내용,작성일시,제목_길이,내용_길이,제목_토큰_갯수,내용_토큰_갯수,제목_명사,내용_명사
매일경제,"더존비즈온, 춘천 ‘개인정보 안심구역’ 본격 운영","
 민간 최초 운영기관 지정의료데이터 활용 등 지원        사진 확대    더존비즈온 강촌캠퍼스. [더존비즈온]  더존비즈온은 강원 춘천 강촌캠퍼스 내 첨단의료 분야 특화 개인정보 안심구역을 본격적으로 운영한다고 8일 밝혔다.앞서 더존비즈온은 지난해 민간 기업 최초로 개인정보 안심구역 운영기관으로 선정됐다.개인정보 안심구역은 가명정보를 안전하게 처리하고 활용할 수 있는 보안 공간이다. 데이터 품질 훼손을 최소화하고 안전하게 처리할 수 있도록 지원한다.특히 의료 데이터는 개인정보 보호 측면에서 매우 민감한 데이터로 분류되기 때문에 안전한 환경이 필수적이다. 개인정보 안심구역은 기업과 연구기관이 이러한 데이터를 보다 안전하게 활용할 수 있는 환경을 제공한다.더존비즈온은 안심구역 운영을 통해 의료 데이터를 활용한 인공지능(AI) 모델 개발을 적극 지원할 계획이다. AI와 빅데이터 기술을 접목한 의료 및 바이오산업의 혁신이 기대된다.춘천 광판리에 조성될 기업혁신파크와의 연계성도 강화할 계획이다. 춘천 기업혁신파크는 더존비즈온이 앵커기업으로 참여하는 사업이다. ICT, 바이오, AI 등 첨단 지식산업을 위한 생태계 조성을 목표로 한다.더존비즈온 송호철 플랫폼사업부문 대표는 “이번 개인정보 안심구역 운영이 데이터 보호와 활용 간의 균형을 실현하는 데 있어 중요한 전환점이 될 것”이라며 “정밀의료와 바이오산업의 발전뿐 아니라 중소기업 데이터 플랫폼 구축 등 다양한 분야에서 데이터 활용 생태계를 활성화하기 위해 지속적으로 노력할 것”이라고 말했다.
",2025-01-08 09:19:48,27,761,6,162,비즈 춘천 개인 정보 안심 구역 본격 운영,민간 최초 운영 기관 지정 의료 데이터 활용 등 지원 사진 확대 더존 비즈 온 강촌 캠퍼스 더존 비즈 온 더존 비즈 온 강원 춘천 강촌 캠퍼스 내 첨단 의료 분야 특화 개인정보 안심 구역 본격 운영 앞서 더존 비즈 온 지난해 민간 기업 최초 개인정보 안심 구역 운영 기관 선정 개인정보 안심 구역 가명 정보 처리 활용 수 보안 공간 데이터 품질 훼손 최소 처리 수 지원 의료 데이터 개인정보 보호 측면 매우 데이터 분류 때문 환경 필수 개인정보 안심 구역 기업 연구기관 데이터 활용 수 환경 제공 더존 비즈 온 안심 구역 운영 통해 의료 데이터 활용 인공 지능 모델 개발 적극 지원 계획 빅데이터 기술 접목 의료 및 바이오 산업 혁신 기대 춘천 광판리 조성 기업 혁신 파크 계 계획 춘천 기업 혁신 파크 더존 비즈 온 앵커 기업 참여 사업 바이오 등 첨단 지식 산업 위 생태계 조성 목표 더존 비즈 온 송호 철 플랫폼 사업 부문 대표 이번 개인정보 안심 구역 운영 데이터 보호 활용 간의 균형 실현 데 전환 점 것 라며 정밀 의료 바이오 산업 발전 중소기업 데이터 플랫폼 구축 등 분야 데이터 활용 생태계 활성화 위해 지속 노력 것 말
매일경제,[속보] 삼성전자 4분기 영업익 6.5조원…시장전망 밑돌아,"
 매출액 75조 원, 전년비 10.65% 증가영업익 6조5000억 원, 전년비 130.5% 증가전분기 대비로는 영업이익 29.19% 줄어        사진 확대    삼성전자. 연합뉴스  삼성전자는 작년 4분기 연결기준 잠정 영업 실적을 8일 발표했다. 매출액은 75조 원으로 전년 동기 대비 10.65% 증가했으며, 영업이익은 6조5000억 원으로 130.50% 증가했다.하지만 전 분기 대비로 매출액은 5.18% 감소했고, 영업이익은 29.19% 줄었다. 시장전망치였던 7조7000억원 수준에도 미치지 못했다.작년 전체로는 매출액이 300조800억 원으로 전년 대비 15.89% 증가했으며, 영업이익은 32조7300억 원으로 398.17% 늘었다.
",2025-01-08 08:43:41,32,366,6,68,속보 삼성전자 분기 영업 익 조 원 시장 전망,매출 액 원 년비 증가 영업 익 원 년비 증가 분기 대비 영업 이익 사진 확대 삼성 전자 연합뉴스 전자 작년 연결 기준 잠정 영업 실적 발표 매출 액 원 년 동기 대비 증가 영업 이익 원 증가 전 분기 대비 매출 액 감소 영업 이익 장전 수준 작년 전체 매출 액 원 년 대비 증가 영업 이익 원
매일경제,"“LG생활건강, 4Q 영업익 시장 전망치 밑돌 전망”…목표가↓","
      사진 확대    LG생활건강. [사진 출처 = LG생활건강]  하나증권은 8일 LG생활건강에 대해 지난해 4분기 영업이익이 컨센서스(증권사 전망치 평균)를 밑돌 것으로 예상된다며 목표주가를 기존 39만원에서 35만원으로 하향 조정했다. 투자의견은 ‘중립’을 유지했다.LG생활건강의 4분기 연결 기준 영업이익은 전년동기대비 8% 감소한 502억원으로 컨센서스를 밑돌 것으로 전망했다. 같은 기간 매출액은 1% 줄어든 1조5000억원으로 추정했다.실적 부진의 주요인으로는 생활용품과 음료 부문의 수요 위축, 수익성 하락을 꼽았다. 화장품 부문의 경우 중국 수요 부진과 대량 통관(다이고) 물량 위축 등으로 전분기와 유사한 추세가 이어질 것으로 내다봤다.LG생활건강의 올해 이익은 정체될 것으로 전망했다. 올해는 전반적으로 이익 체력이 낮아진 상황에서 성장 동력을 확보하기 위한 투자 단계라는 평가다.회사는 지난해부터 화장품 전반의 구조 개편을 진행하고 있다. 주요 방향은 중국 시장 회복과 비중국 지역에서의 성장 동력 마련, 국내 성장 채널 집중 등이다.중국에서는 ‘더후’ 리브랜딩이 본격적으로 진행된다. 북미 지역에서는 ‘에이본’의 구조조정이 일단락됐으며 자체 브랜드를 통한 성장이 기대된다는 설명이다.다만 면세 부문은 구조적으로 급격한 반등은 어려울 것으로 봤다.박은정 하나증권 연구원은 “최근 경영진은 성장 동력 부재에 대한 대안으로 비유기적 성장의 필요성을 강조했다”며 “특히, 일본과 북미 등에서 두각을 나타내는 기능성, 스킨케어 브랜드가 글로벌 확장과 이익 체력 확보 측면에서 시너지를 발휘할 것으로 기대된다”고 말했다.
",2025-01-08 08:07:06,34,807,7,171,생활 건강 영업 익 시장 전망 전망 목표,사진 확대 생활 건강 사진 출처 생활 건강 하나 증권 생활 건강 대해 지난해 영업 이익 컨센서스 증권사 망치 평균 를 밑돌 것 예상 목표 주가 기존 하향 조정 투자 의견 중립 유지 생활 건강 연결 기준 영업 이익 년 대비 감소 컨센서스 밑돌 것 전망 기간 매출 액 추정 실적 부진 요인 생활용품 음료 부문 수요 위축 수익 하락 꼽았다 화장품 부문 경우 중국 수요 부진 대량 통관 다이고 물량 위축 등 분기 추세 것 생활 건강 올해 이익 정체 것 전망 올해 전반 이익 체력 상황 성장 동력 확보 위 투자 단계 평가 회사 지난해 화장품 전반 구조 개편 진행 주요 방향 중국 시장 회복 비 중국 지역 성장 동력 마련 국내 성장 채널 집중 등 중국 더후 리브랜딩 본격 진행 북미 지역 에이본 의 구조조정 일단락 자체 브랜드 통한 성장 기대 설명 다만 면세 부문 구조 반등 것 박은정 하나 증권 연구원 최근 영진 성장 동력 부재 대한 대안 비유 기적 성장 필요성 강조 며 일본 북미 등 각 기능 스킨 케어 브랜드 글로벌 확장 이익 체력 확보 측면 시너지 발휘 것 기대 고 말
매일경제,"“잡음 듣기 싫다”…손 빨라진 국민연금, 최근 팔아치운 종목들 살펴보니","
 유상증자·경영권다툼 등리스크로 판단해 지분 줄여주가 급등 바이오 차익실현이마트·현대글로비스 등실적기대주는 투자비중 늘려        사진 확대     국내 최대 기관 투자자인 국민연금공단(국민연금)이 지난해 자본시장에서 논란을 빚었던 기업들 주식을 팔아치운 것으로 나타났다.평가가치가 올라 고점이라고 판단되는 주식들에 대해서도 차익 실현에 나서는 모습을 보였다.반대로 향후 실적 상승이 기대되거나 주가가 바닥이라고 여겨지는 기업들 지분은 늘렸다.7일 금융감독원 전자공시 시스템에 따르면 국민연금은 지난해 11~12월 세 차례에 걸쳐 총 208만9753주의 이수페타시스 주식을 팔아치웠다.이수페타시스는 탄소나노튜브(CNT) 제조업체인 제이오 인수를 위해 유상증자를 추진해왔다.금감원이 투자자의 합리적인 판단 등을 해칠 수 있다는 이유로 유상증자에 제동을 걸었지만 이수페타시스는 정정신고서를 제출하는 등 제이오 인수를 위한 자금 조달 의지를 강하게 보였다.이 같은 소식이 전해지자 국민연금은 이수페타시스의 지분을 일부 정리했다.인공지능(AI) 시대 도래로 인쇄회로기판(PCB) 생산을 주력으로 하는 이수페타시스가 주목받을 것이라고 보고 그동안 지분을 늘려왔지만 지난 4분기에만 10.74%에서 7.43%로 대폭 줄였다.증권업계에서도 이수페타시스의 제이오 인수를 긍정적으로 평가하지 않는다.권태우 KB증권 연구원은 “CNT시장 진입을 위한 제이오 인수와 관련된 자금 조달이 주당순이익(EPS) 희석을 초래해 투자 리스크를 유발했다”며 “이수페타시스가 과거처럼 높은 멀티플을 유지하기는 어려울 것으로 보인다”고 했다.      사진 확대    DB하이텍 부천캠퍼스 전경 [사진 출처 = DB하이텍]  국민연금은 자본시장에서 논란을 빚었던 DB하이텍 지분도 조정했다.2024년 10월 44만9770주를 줄인 데 이어 DB하이텍 소액주주단체가 KCGI에 지분 매매 차익 의혹으로 소송을 건 이후인 지난해 11월 29일 45만7602주를 팔았다.지분율은 9.32%에서 7.27%로 줄었다.KCGI는 2023년 3월 DB하이텍 지분 313만주를 취득하고 경영권 참여를 선언했으나 일부를 DB하이텍 모회사인 DB Inc.(DB아이앤씨)에 매각해 차익을 실현했다.소액주주들은 대규모 손실을 봤다고 주장하면서 검찰에 KCGI를 고소했다.공개매수 경쟁 과정에서 주가가 치솟았던 고려아연에 대해서도 국민연금은 차익실현에 나섰다.MBK 공개매수 마감일, 고려아연의 자사주 공개매수 결제일 등을 감안해 지분율을 7.49%에서 4.51%로 낮췄다.국내 기업에 장기 투자를 한다는 목적으로 지분율을 계속 유지하는 국민연금이지만 자본시장에서 논란을 빚었던 기업들의 변동성이 커졌다는 판단하에 주식을 매도한 것으로 해석된다.이외에 국민연금은 지난해 하반기 주식시장에서 큰 주목을 받았던 바이오주(리가켐바이오, HK이노엔, 에이비엘바이오, 지아이이노베이션), 뷰티주(파마리서치, 클리오, 코스메카코리아, 씨앤씨인터내셔널), 삼양식품, 엠로 등에 대해서도 차익 실현에 나섰다.      사진 확대    이마트. 사진=연합뉴스  반면 향후 기업가치가 개선되면서 실적이 상승할 가능성이 높은 기업들에 대해선 지분을 늘렸다.알리바바와 합작법인을 설립하는 이마트의 경운 국민연금은 지분율을 7.95%에서 10.01%로 늘렸다.신세계그룹은 G마켓을 현물 출자하는 방식으로 참여하며 양사 출자 비율은 5대5로 동등하다.백재승 삼성증권 연구원은 “G마켓의 한국 셀러들 확보에 대한 경쟁력과 알리익스프레스의 글로벌 소싱 능력을 서로 활용할 수 있고 두 이커머스 플랫폼을 모두 이용할 수 있다는 장점을 토대로 신규 셀러 모집이 좀 더 원활해질 수 있다는 시너지 효과를 기대해볼 만하다”고 했다.아울러 국민연금은 해상운송 사업 확대로 수익성 개선이 예상되는 현대글로비스, 전기차·자율주행 솔루션 기업 HL만도, 국내 사모펀드 운용사 H&Q코리아가 투자한 현대엘리베이터 등에 대해서도 지분을 확대했다.
",2025-01-08 00:42:24,39,1931,9,371,잡음 손 국민 연금 최근 종목,유상증자 경영 다툼 등 리스크 판단 분 급등 바이오 차익 실현 이마트 현대 글로비스 등 실적 대주 투자 비중 사진 확대 국내 최대 기관 투자자 국민연금 공단 국민연금 이 지난해 자본시장 논란 빚었던 기업 주식 것 평가 가치 점 판단 주식 대해 서도 차익 실현 모습 반대 향후 실적 상승 거나 주가 바닥 기업 분 금융감독원 자공시 시스템 국민연금 지난해 세 차례 총 주의 페타 시스 주식 팔 페타 시스 탄소 나노튜브 제조업체 이오 인수 위해 유상증자 추진 금감원 투자자 합리 판단 등 수 이유 유상증자 제동 페타 시스 정정 고서 제출 등 이오 인수 위 자금 조달 의지 이 소식 국민연금 페타 시스 분 일부 정리 인공 지능 시대 도래 인쇄회로기판 생산 주력 페타 시스 주목 것 보고 그동안 분 지난 로 대폭 증권 업계 페타 시스 이오 인수 긍정 평가 권태 증권 연구원 시장 진입 위 이오 인수 관련 자금 조달 순이익 석 초래 투자 리스크 유발 며 페타 시스 과거 멀티 유지 것 고 사진 확대 하이 텍 부천 캠퍼스 전경 사진 출처 하이 텍 국민연금 자본시장 논란 빚었던 하이 텍 분도 조정 주 데 하이 텍 소액 단체 분 매매 차익 의혹 소송 건 이후 지난해 주 분율 로 하이 텍 분 취득 경영 참여 선언 일부 하이 텍 모회사 아이 앤 매각 차익 실현 소액 주주 대규모 손실 주장 검찰 를 공개매수 경쟁 과정 주가 고려아연 대해 서도 국민연금 차익 실현 공개매수 마감 일 고려아연 자 사주 공개매수 결제 일 등 감안 분율 로 국내 기업 장기 투자 목적 분율 계속 유지 국민연금 자본시장 논란 빚었던 기업 변동성 판단 주식 매도 것 해석 이외 국민연금 지난해 하반기 주식시장 주목 바이오 주 리가 켐 바이오 이노 에이 비엘 바이오 아이 이노베이션 뷰티 주 파마 리서치 클리오 코스 메카 코리아 씨앤 인터내셔널 삼양식품 엠로 등 대해 서도 차익 실현 사진 확대 이마트 사진 연합뉴스 반면 향후 기업가 치가 개선 실적 상승 가능성 기업 대해 선 분 알리바바 합작 법인 설립 이마트 경운 국민연금 분율 로 신세계 그룹 마켓 현물 출자 방식 참여 양사 출자 비율 로 동등 재승 삼성 증권 연구원 마켓 한국 셀러 확보 대한 경쟁력 알리 익스 프레 스 글로벌 소싱 능력 서로 활용 수 두 이커머스 플랫폼 모두 이용 수 장점 토대 신규 셀러 모집 좀 더 수 시너지 효과 기대 만하 고 국민연금 해상 운송 사업 확대 수익 개선 예상 현대 글로비스 전기차 자율 주행 솔루션 기업 만도 국내 사모펀드 운용 사 코리아 투자 현대 엘리베이터 등 대해 서도 분 확대
매일경제,"금감원, 고려아연 경영진 檢에 수사의뢰","


유상증자 부정거래 의혹


고려아연이 경영권 분쟁 과정에서 자사주 공개매수에 이어 유상증자를 발표한 사건이 금융감독원 조사를 거쳐 검찰로 이첩됐다.
7일 금융투자업계에 따르면 금감원은 지난해 공개매수와 유상증자를 진행한 고려아연의 경영진 등을 자본시장법 위반 혐의로 검찰에 이첩했다. 금융위원회의 의결을 거치지 않은 패스트트랙(신속 수사 전환) 절차로 사건이 넘어간 것이다.
금감원은 고려아연 경영진 측의 허위 기재 혐의가 자본시장법 178조가 규정한 부정 거래에 해당한다고 보고 있다. 178조는 증권 매입 등 금융투자상품을 매매할 때 부정한 수단과 위계를 사용하는 행위를 금지하고 있다.
앞서 금감원은 고려아연이 유상증자 계획을 수립한 상태에서 공개매수에 나선 사실관계가 확인되면 사건을 검찰에 이첩하겠다고 예고한 바 있다. 공개매수를 위한 서류에 ""공개매수 이후 재무 구조 등에 변경을 가져오는 계획을 수립하고 있지 않다""고 명기한 것이 허위 기재, 부정 거래에 해당하기 때문이다.
고려아연은 지난해 10월 4일부터 23일까지 자사주 공개매수를 진행한 뒤 30일 기습적으로 유상증자를 발표했다. 이후 최윤범 고려아연 회장 등이 경영권 방어를 위해 기존 주주들의 이익을 침해했다는 당국과 업계의 비판이 이어졌다. 함용일 금감원 부원장은 고려아연의 유상증자 발표 직후 기자간담회에서 ""고려아연 이사회가 차입을 통해 자사주를 취득해서 소각하겠다는 계획, 그 후에 유상증자로 상환할 것이라는 계획을 모두 알고 해당 절차를 순차적으로 진행했다면 기존 공개매수 신고서에는 중대한 사항이 빠진 것이고, 부정 거래 소지가 다분한 것으로 본다""고 말했다.
또 ""입증을 거쳐 불공정 거래가 확인되면 신속한 처리를 위해 적극적으로 수사기관에 이첩할 것""이라며 ""증권신고서 정정 요구도 필요하면 계속하고 법령상 권한을 최대한 활용하겠다""고 밝혔다.
고려아연이 증권신고서 허위 기재가 실수였다고 해명한 뒤에도 당국은 ""과실이든 고의든 책임을 지면 될 문제""라며 ""시장을 어떤 방식으로 설득하고 납득시킬 수 있을지에 대한 고민이 중요하다""는 입장을 내놨다.
유상증자 계획은 고려아연 주가에도 큰 영향을 끼쳤다. 경영권 분쟁으로 한때 150만원을 상회했던 주가가 유상증자 발표 후 하락하며 계획을 철회하던 시점에는 100만원을 하회했다. 금감원은 고려아연의 유상증자 계획에 증권신고서 정정을 요구했고, 그로부터 일주일 만인 지난해 11월 13일 고려아연은 유상증자 결정을 철회했다. 고려아연의 자사주 공개매수 주관사이자 유상증자 모집 주선인인 미래에셋증권, KB증권도 금감원의 조사를 받은 바 있다. 적절한 검토를 거쳐 공개매수·유상증자 발표가 이뤄졌는지, 불공정 거래 행위가 있었는지 등이 조사 대상이었다.
[문재용 기자]

",2025-01-07 22:50:54,21,1350,5,301,금감원 고려 아연 경영진 수사 의뢰,유상증자 부정 거래 의혹 고려아연 경영 분쟁 과정 자 사주 공개매수 유상증자 발표 사건 금융감독원 조사 검찰 이첩 금융투자 업계 금감원 지난해 공개매수 유상증자 진행 고려아연 영진 등 자본시장 법 위반 혐의 검찰 이첩 금융 위원회 의결 거치 패스트 트랙 신속 수사 전환 절차 사건 것 금감원 고려아연 영진 측 허위 기재 혐의 자본시장 법 규정 부정 거래 해당 고 보고 증권 매입 등 금융투자 상품 매매 때 부정 수단 위계 사용 행위 금지 앞서 금감원 고려아연 유상증자 계획 수립 상태 공개매수 나선 사실관계 확인 사건 검찰 이첩 예고 바 공개매수 위 서류 공개매수 이후 재무 구조 등 변경 계획 수립 고 명기 것 허위 기재 부정 거래 해당 때문 고려아연 지난해 자 사주 공개매수 진행 뒤 기습 유상증자 발표 이후 최윤 범 고려아연 회장 등 경영 방어 위해 기존 주주 이익 침해 당국 업계 비판 일 금감원 부원장 고려아연 유상증자 발표 직후 기자간담회 고려아연 이사회 차입 통해 자 사주 취득 소각 계획 그 후 유상증자 상환 것 계획 모두 알 해당 절차 순차 진행 기존 공개매수 고서 사항 것 부정 거래 소지 것 고 말 또 입증 불공정 거래 확인 처리 위해 적극 기관 이첩 것 라며 증권 신고 정정 요구 계속 법령 권한 최대한 활용 고 고려아연 증권 신고 허위 기재 실수 해명 뒤 당국 과실 고의 책임 지면 문제 라며 시장 방식 설득 납득 수 대한 고민 입장 유상증자 계획 고려아연 주가 영향 경영 분쟁 상회 주가 유상증자 발표 후 하락 계획 철회 시점 회 금감원 고려아연 유상증자 계획 증권 신고 정정 요구 그로 일주일 만인 지난해 고려아연 유상증자 결정 철회 고려아연 자 사주 공개매수 주관 사이 유상증자 모집 선인 미래에셋 증권 증권 금감원 조사 바 검토 공개매수 유상증자 발표 불공정 거래 행위 등 조사 대상 문 기자
