언론사,제목,내용,작성일시,제목_길이,내용_길이,제목_토큰_갯수,내용_토큰_갯수,제목_명사,내용_명사
한국경제,"[마켓칼럼] 올해도 주식이 매력적인 투자처…""日·中 증시도 주목""","





※한경 마켓PRO 텔레그램을 구독하시면 프리미엄 투자 콘텐츠를 보다 편리하게 볼 수 있습니다. 텔레그램에서 ‘마켓PRO’를 검색하면 가입할 수 있습니다.











우현철 플레인바닐라투자자문 이사 지난해 미국 증시가 28% 상승한 데 이어 일본과 중국 증시도 각각 17%, 20% 올랐다. 지난 2년간 미국 증시 연평균 상승률은 27%, 일본 증시는 26%에 달한다. 미국 증시의 질주는 과거 1995년~1999년을 떠오르게 한다. 당시 냉전이 종식되고 세계화의 열풍에 이어 닷컴 기업들이 지수 상승을 이끌었다. 미국 S&P500은 5년간 연평균 28%의 상승 랠리를 이어갔다. 당시 주식시장 붐의 이유는 복합적이다. 자유 시장경제의 승리를 배경으로 금리가 하락 안정세를 타던 시기다. 국내총생산(GDP) 역시 연 평균 4%대로, 기업이익도 급증했다. 이런 성장 스토리의 뒤엔 테크놀로지가 자리잡고 있다. 당시 나스닥 지수는 5년간 5배 이상 올랐는데, 실제 현금흐름이 없는데도 혁신 기대와 ‘포모(FOMO: 뒤처짐에 대한 공포)’로 자금이 쏠리면서다. 하지만 밀레니엄의 서막을 알린 후 시장은 곧 무너지기 시작했고, 3년 뒤 상승분의 대부분을 반납했다. 당시를 닷컴 버블이라고 부른다.그렇다면 지금 시기는 어떨까, 거시경제와 지정학적 환경, 통화정책 측면에서 보면 1995년~1999년 당시 상황보다 결코 좋다고 보기 어렵다. 물가와 금리, 통화정책, 무역 및 지정학적 갈등 등 어느 측면에서도 안정감을 찾기 어렵다. 그럼에도 증시는 상승하고 있다. 근래의 지수 상승은 철저히 혁신 기술의 성장에 기반하고 있다. 생성형 인공지능(AI) 챗GPT를 기반으로 AI용 그래픽카드(GPU)·데이터센터와 전기차를 중심으로 한 2차전지 등 다양한 산업군이 증시를 이끈다.닷컴 버블 시기와 달리 ‘매그니피센트7’(미국 대형 기술주 7개 종목)을 중심으로 한 기술주와 시가총액 상위 10개 기업의 주당순이익(EPS)은 5년간 약 550%, 최근 2년간은 120% 성장했다. 강력한 실적 성장을 기반으로 주가가 상승하다 보니 주가수익비율(PER) 멀티플은 1999년 당시 30배로 부풀었던 것과는 달리 지금은 25배 수준에 머물러 있다.트럼프 기대감과 확산과거 트럼프 1기 행정부(2017~2020년) 때 S&P500지수는 연평균 약 16% 상승했다. 기업 이익은 취임 당시 13%, 2년 차 2018년엔 감세정책에 힘입어 22% 증가했다. 트럼프 2기에 대한 기대도 이 맥락에서 벗어나지 않는다. 다만 그간 높은 이익 성장을 기록했던 매그니피센트7 기업들의 이익 성장 속도가 올해 소폭 둔화될 가능성이 높다. 구체적으로 올해 S&P500의 이익 성장은 10%로 예상하고 있다. 밸류에이션을 감안한 S&P500지수의 상승 기대 수익률도 약 10% 수준이다. 목표 지수대는 6700선이다.올해 미국 증시와 관련해선 기대수익 눈높이를 낮추거나 다른 자산들로 두루두루 살피는 것이 필요하다. 특히 트럼프의 감세 정책과 기업지원책 등이 더해지고, 물가와 금리가 안정을 찾게 되면 중소형주와 더불어 다양한 업종의 이익 성장 속도가 빨라질 수 있다. 현재 S&P400 중형주 지수와 S&P600 소형주 지수의 PER 수준은 각각 19배와 20배에 불과하다. 기존 매그니피센트의 성장세의 바통을 이어받을 가능성이 충분하다.글로벌에서 미국 외 일본과 중국 주목 일본은 미국과 대만 등을 제치고 최근 3년 기준 누적수익률 최상위 증시다. 일본의 EPS는 지난해 185엔에서 올해 205엔으로 약 11% 성장할 가능성이 있다. 이는 미국의 EPS 성장을 초과하는 수치다. 올해 수입과 수출성장 속도가 가팔라질 것으로 예상돼 명목 GDP는 3.5%로 예상된다. 이는 한국(물가 제외)과 비슷한 수준까지 회복되는 것을 의미한다. 올해 일본의 임금 상승률은 3% 수준으로 예상된다. 물가는 2%대의 안정적 흐름을 보일 전망이다. 향후 엔화 강세를 고려하면 일본 증시에서 점진적으로 투자 비중을 높일 필요가 있다.
                    



사진=게티이미지뱅크 

                중국은 최근 3년간 모건스탠리캐피털인터내셔널(MSCI) 차이나 지수 기준으로 27% 하락했다. 이렇다 보니 국내 투자자들의 신뢰가 무너진 상황이지만, 장기 포트폴리오에선 절대 투자의 끈을 놓지 말아야 한다. 중국은 이미 9월과 12월 중앙정치국회의를 통해 올해 적극적인 재정정책과 완화된 통화정책을 암시했다. 본격적인 내수 활성화와 증시 부양에 대한 가능성을 확인했다. 중국증시의 유동성 척도인 마진(신용)거래 규모는 최근 9년래 가장 커진 상황으로, 앞으로 시장 기대 이상의 정책이 나온다면 증시는 반등할 가능성이 높다. 중국의 올해 성장률은 4.5%대로 예상, 기업이익 증가율은 9%대로 추정한다. 금융 부문의 성장을 제외하고 인터넷 부문과 기술주 등의 성장률은 약 13%로 예상된다. 물론, 트럼프 2기에 미국과의 무역갈등 심화를 우려하는 시각도 있다. 하지만 예측 가능한 우려가 위기가 되는 경우는 보지 못했다. 또 중국의 부동산 연계 지방재정 위기와 그림자금융 부실에 대한 뇌관이 10년째 터지지 않는 만큼, 정부 주도하에 극복되고 있다고 판단된다.  한국, 투자기회(Opportunity)의 영역 진입올해 한국 증시와 관련해선 투자자들의 기대치가 높지 않다. 올해 수출은 경기순환 사이클 측에서 성장세가 둔화되어 약 1.5% 성장이 예상된다. 산업생산도 1%대, GDP는 2% 아래로 내려갈 것으로 본다. 이런 거시적 예측이 주가에 선반영되고 있다. 코스피의 영업이익을 보면 2023년 -31%, 지난해엔 약 50% 성장했다. 올해는 약 20%의 성장이 예상된다. 참고로 반도체 대표 주자인 삼성전자와 하이닉스의 영업이익이 둔화돼 올해 각각 11%와 37% 성장을 예상한다. 이익성장과 장부가치를 반영한 포워드 PER은 현재 9.86배, PBR은 0.88배로 낮아진 상황이다. 역사적인 밴드 하단으로 진입했다. 경기순환을 자연스럽게 해석하면 2026년과 2027년 한국의 GDP와 수출은 다시 정상궤도의 성장흐름을 기대할 수 있다.코스피 지수는 지난해 10% 하락했다. 다른 국가들이 모두 급등하는 상황에서 한국만 하락한 것은 ▲한국이 유독 경기순환의 민감도가 크고 ▲반도체 및 경기둔화 불확실성이 과도하게 반영되며 ▲환율 변동성도 심하기 때문이다. 정치권의 혼란과 계엄 이후 불확실성이 확대 등도 이유로 꼽힌다.밸류에이션 측면에선 경기 둔화와 반도체 업황 우려는 이미 시장에 과도하게 반영됐다고 판단한다. 향후 금리를 더 낮추기 어렵다는 점에서 환 변동성도 줄어들 것으로 본다. 정치 불확실성도 수개월 내 사라질 것으로 전망한다.1분기 중 언제든 시장조정 가능성을 열어둬라1월 미국 증시는 무난한 흐름을 예상한다. 오는 20일 트럼프 대통령 취임 이후 각종 정책을 쏟아질 전망이다. 관세 내용이 나올 때마다 시장의 변동성이 확대할 수 있지만 예상 범주 내의 수준이라면 오히려 불확실성을 해소될 수 있다. 이 경우 증시는 랠리를 이어갈 것이다.이달 중순부터 다음달 말에 예정된 주요 핵심 기업들의 4분기 실적 발표를 계기로 증시 방향성은 정해질 것으로 본다. 결국 관세와 통화정책, 경기지표, 이익성장이 수렴되는 1월 말 이후가 변동성을 키울 수 있는 시점이다. 상승 피로도가 누적된 상황에서 센티먼트가 약화되면 예상보다 조정폭이 커질 수 있다. 이 시기에 각별히 포트폴리오 위험관리에 신경 써야 한다. 매그니피센트7 대형 기술주 움직임에 주목할 필요가 있다. 현재 시가총액 내 초대형 성장주들이 점유한 비중이 지나치게 비대해졌기 때문이다. 현재 매그니피센트7 종목의 시가총액은 S&P500 내 약 31%를 차지하고, 10종목으로 넓히면 39%에 달한다. 나스닥100지수를 기준으로 보면 매그니피센트7 종목의 비중은 61% 수준이다.특정 종목들의 시장지배력이 커졌다는 것은 주가지수 변동성 확대를 수반한다. 최선의 위험 대응전략은 성장과 배당, 미국과 글로벌, 주식과 채권 등 다양한 성격의 자산들로 분산하는 것이다. 상반기엔 조급하지 않게 저가매수 대응올해도 주식이 가장 매력적인 투자처라고 본다. 견조한 실적을 기반으로 상승 랠리가 이어질 것으로 전망한다. 상반기보단 하반기에 정책부양 기대감이 높아지며 랠리가 이어질 가능성이 크다. 증시에 대한 기대수익도 하반기를 높게 잡는다. 상반기의 조정은 그릇을 채울 좋은 기회로 활용할 수 있다. 미국 성장주와 중소형주, 일본과 중국 주식, 단기채와 장기채를 적절히 분산할 필요가 있다. 주가가 급락하면 테마보다는 지수 중심으로, 금리가 급등하면 리츠와 중소형주로 대응하면 된다.금리가 안정을 찾으면 달러 강세도 한계를 보일 전망이다. 달러는 향후 미국의 성장지표와 재정수지와 무역수지, 에너지 수출 등을 고려할 때 당분간 강세를 유지할 것으로 예상되나 지난 트럼프 재임 기간 중 달러 스탠스는 손바닥 뒤집듯이 바뀌었던 것을 기억한다. 달러가 전체 자산의 위험관리와 손익평가 측면에서 중요해진 만큼 주의 깊게 추적할 필요가 있다. 다만 원·달러 혼자 약세를 보이며 1500원 이상에 머무를 가능성은 낮게 본다. 1400원대가 정상적인 수준이라고 생각한다.마지막으로, 한국 주식시장을 외면할 필요는 없다. 모두가 두려워할 때 KOSPI200 ETF나 국내 주식형 펀드로 분할매수하는 전략은 현명한 기회 투자 전략이자 좋은 변동성 관리 투자라고 본다.
                                    ",2025.01.07 16:31,36,4625,7,1021,마켓 칼럼 올해 주식 매력 투자처 日 中 증시 주목,한경 마켓 텔레그램 구독 프리미엄 투자 콘텐츠 볼 수 텔레그램 마켓 를 검색 가입 수 우현 철 플레인 바닐라 투자 자문 이사 지난해 미국 증시 상승 데 일본 중국 증시 각각 지난 미국 증시 평균 상 승률 일본 증시 달 미국 증시 질주 과거 당시 냉전 종식 세계 화의 열풍 기업 지수 상승 미국 은 평균 의 상승 랠리 당시 주식시장 붐 이유 복합 자유 시장경제 승리 배경 금리 하락 안정 세 시기 국내총생산 역시 연 평균 대로 기업 이익 급증 성장 스토리 뒤 테크놀로지 자리 잡고 당시 나스닥 지수 배 이상 실제 현금 흐름 혁신 기대 포모 뒤 대한 공포 로 자금 면서 밀레니엄 서막 후 시장 곧 시작 뒤 상승 대부분 반납 당시 버블 지금 시기 거시경제 지정학적 환경 통화정책 측면 당시 상황 결코 보기 물가 금리 통화정책 무역 및 지정학적 갈등 등 측면 안정감 찾기 증시 상승 근래 지수 상승 혁신 기술 성장 기반 생 성형 인공 지능 챗 를 기반 용 그래픽카드 데이터 센터 전기차 중심 등 산업 증시 버블 시기 달리 그니 피 센트 미국 대형 기술 주 개 종목 중심 기술 주 시가총액 상위 개 기업 순이익 은 약 최근 실적 성장 기반 주가 상승 주가 수익 비율 멀티 은 당시 배 것 달리 지금 배 수준 트럼프 대감 확산 과거 트럼프 기 행정부 때 지수 평균 약 상승 기업 이익 취임 당시 차 감세 정책 힘 증가 트럼프 대한 이 맥락 다만 그간 이익 성장 기록 그니 피 센트 기업 이익 성장 속도 올해 폭 둔화 가능성 구체 올해 의 이익 성장 로 예상 밸류 션 감안 지수 상승 기대 수익률 약 수준 목표 지수 선 올해 미국 증시 관련 선 수익 눈높이 다른 자산 두루 두루 것 트럼프 감세 정책 기업 지원 책 등 물가 금리 안정 중소형주 업종 이익 성장 속도 수 현재 중형 주 지수 형주 지수 수준 각각 배 배 기존 그니 피 센트 성장 세 바통 가능성 글로벌 미국 외 일본 중국 주목 일본 미국 대만 등 제 최근 기준 누적 수익률 최 상위 증시 일본 지난해 올해 약 가능성 미국 성장 초과 수치 올해 수입 수출 성장 속도 팔 질 것 예상 명목 로 예상 한국 물가 제외 과 수준 회복 것 의미 올해 일본 임금 상 승률 수준 예상 물가 대의 안정 흐름 전망 향후 엔화 강세 고려 일본 증시 점진 투자 비중 필요 사진 게티 이미지 뱅크 중국 최근 모건스탠리 캐피털 인터내셔널 차이나 지수 기준 하락 국내 투자자 신뢰 상황 장기 포트폴리오 절대 투자 끈 중국 중앙 정치국 회의 통해 올해 적극 재정정책 완화 통화정책 암시 본격 수 활성화 증시 부양 대한 가능성 확인 중국 증시 유동성 척도 마진 신용 거래 규모 최근 가장 상황 앞 시장 기대 이상 정책 증시 반등 가능성 중국 올해 성장 률 대로 예상 기업 이익 증가 율 대로 추정 금융 부문 성장 제외 인터넷 부문 기술 주 등 성장 률 약 로 예상 트럼프 미국 무역 갈등 심화 우려 시각 예측 우려 위기 경우 보지 또 중국 부동산 계 지방 재정 위기 그림자 금융 부실 대한 뇌관 만큼 정부 극복 판단 한국 투자 기회 의 영역 진입 올해 한국 증시 관련 선 투자자 치가 올해 수출 경기 순환 사이클 측 성장 세 둔화 약 성장 예상 산업 생산 아래 것 거 시적 예측 주가 선 반영 코스피 영업 이익 지난해 약 올해 약 의 성장 예상 참고 반도체 대표 주자 전자 하이닉스 영업 이익 둔화 올해 각각 성장 예상 이익 성장 장부 가치 반영 포워드 은 현재 배 은 배 상황 역사 밴드 하단 진입 순환 자연 해석 한국 수출 다시 정상 궤도 성장 흐름 수 코스피 지수 지난해 하락 다른 국가 모두 급등 상황 한국 하락 것 한국 유독 순환 민감 도 반도체 및 경기 둔화 불확실 과도 반영 환율 변동성 때문 정치권 혼란 계엄 이후 불확실 확대 등 이유 밸류 션 측면 경기 둔화 반도체 업황 우려 시장 과도 반영 판단 향후 금리 더 점 환 변동성 것 정치 불확실 성도 개월 내 것 전망 중 언제 시장 조정 가능성 미국 증시 무난 흐름 예상 트럼프 대통령 취임 이후 각종 정책 전망 관세 내용 때 시장 변동성 확대 수 예상 범주 내의 수준 라면 오히려 불확실 해소 수 이 경우 증시 랠리 것 달 중순 다음 달 말 예정 주요 핵심 기업 실적 발표 계기 증시 방향성 것 관세 통화정책 경기 지표 이익 성장 수렴 말 이후 변동성 수 시점 상승 피로 도 누적 상황 센티먼트 약화 예상 조정 폭 수 이 시기 포트폴리오 위험관리 신경 그니 피 센트 대형 기술 주 움직임 주목 필요 현재 시가총액 내 초대형 장주 점유 비중 비대 때문 현재 그니 피 센트 종목 시가총액 내 약 를 차지 종목 달 나스닥 지수 기준 그니 피 센트 종목 비중 수준 특정 종목 시장 지배 것 주가지수 변동성 확대 반한 최선 위험 대응 전략 성장 배당 미국 글로벌 주식 채권 등 성격 자산 분산 것 상반기 저가 매수 대응 올해 주식 가장 매력 투자 처 견조 실적 기반 상승 랠리 것 전망 상반기 하반기 정책 부양 대감 랠리 가능성 증시 대한 수익 하반기 상반기 조정은 그릇 기회 활용 수 미국 장주 중소형주 일본 중국 주식 단기채 장기 채 분산 필요 주가 급락 테마 지수 중심 금리 급등 리츠 중소형주 대응 금리 안정 달러 강세 한계 전망 달러 향후 미국 성장 지표 재정 수지 무역수지 에너지 수출 등 고려 때 당분간 강세 유지 것 예상 지난 트럼프 재임 기간 중 달러 스탠스 손바닥 것 기억 달러 전체 자산 위험관리 손익 평가 측면 만큼 주의 추적 필요 다만 원 달러 혼자 약세 보이 이상 가능성 정상 수준 생각 마지막 한국 주식시장 외면 필요 모두 때 나 국내 주식 펀드 분할 매수 전략 기회 투자 전략 이자 변동성 관리 투자
한국경제,"상저하고…""코스피 하반기 3000 넘는다""","




한경DB·Getty Images Bank

                ‘푸른 뱀의 해’인 을사년(乙巳年)이 밝았지만 국내 증시 상황은 여전히 안갯속이다. 작년 상반기 선방하던 증시는 하반기 들어 도널드 트럼프 미국 대통령 당선인의 승리와 국내 정치 불안, 기업 실적 둔화가 겹치며 부진한 흐름을 보였다. 증권가에서는 상반기는 변동성이 커지며 증시가 부진하겠지만 하반기 들어 안정되는 ‘상저하고’를 보일 것이란 예상이 나오고 있다. 전문가들은 “변동성이 커지는 한 해에 대처하려면 뱀처럼 유연하고 기민한 투자 전략이 필요하다”고 했다. ○ 을사년 코스피는 ‘상저하고’ 전망





                금융투자업계에 따르면 국내 증권사 13곳이 전망한 2025년 코스피지수의 연간 변동폭은 평균 2360~2935 사이인 것으로 집계됐다. 작년 말 코스피지수 종가(2399.49)와 비교하면 최대 22.31% 오를 수 있다고 본 것이다.증권사별로 보면 SK증권이 코스피지수 상단을 3206으로 가장 높게 제시했다. 이 밖에도 신한투자증권 3100, 키움증권·대신증권 3000 등이 비교적 높게 제시했다. 가장 상단을 낮게 제시한 곳은 iM증권(2750)이었다.다수 증권사는 올해 코스피지수가 상반기엔 부진한 흐름을 보이다가 하반기에 반등세를 나타낼 것이라고 예상했다. 트럼프 당선인이 모든 수입품에 10~20% 수준의 관세를 매기는 ‘보편 관세’가 시행된다면 물가 상승으로 글로벌 경제에 악영향을 미치겠지만, 하반기 들어서는 차츰 영향이 줄어들 것이란 관측이다.긍정적 전망의 근거로 국내 증시의 극단적 저평가와 외국인 자금 및 대기자금 재유입 가능성이 꼽힌다. 코스피지수의 12개월 후행 주가순자산비율(PBR)은 지난 2일 기준 0.87배까지 내려와 통상 저평가 기준으로 꼽히는 1배를 크게 밑돌고 있다.





                외국인 순매도세는 증시 저가 매력이 부각되며 최근 약해지고 있다. 작년 9월 7조4279억원에 달한 국내 증시 외국인 순매도세는 이후 매월 줄어들어 12월 2조8649억원으로 둔화했다. 개인투자자들의 증시 대기자금도 새해를 맞아 증가하고 있다. 2일 투자자 예탁금은 57조582억원으로 작년 말 54조2426억원 대비 2조8156억원 늘었다.김성노 BNK투자증권 연구원은 “트럼프 정부의 보편 관세 영향으로 세계 경제는 상반기 부진하겠지만 하반기엔 상승세를 보일 것”이라며 “한국의 경제성장률도 내년 1분기를 저점으로 완만한 회복세에 접어들 것”이라고 했다.양일우 삼성증권 연구원은 “트럼프 정부의 정책이 가시화된다면 미국의 소득세·법인세 인하, 에너지 생산 확대를 통한 물가 완화가 오히려 글로벌 증시에 긍정적인 영향을 줄 수도 있다”고 했다. 김대준 한국투자증권 연구원도 “통화 완화 정책이 지속되면 경제 전반에 저금리 효과가 나타날 수 있다”며 “지수에 투자할 경우 2분기를 저가 매수 시기로 잡아야 한다”고 했다. ○ “뱀처럼 유연한 전략 세워야”





                전문가들은 올해 증시 변동성 확대에 대비해 유연한 전략을 세우라고 입을 모았다. NH투자증권은 상반기가 오히려 저가 매수 기회일 수 있다고 조언했다. 업종별로는 하반기 낙폭이 컸던 ‘K푸드’ ‘K드라마’ 등 식음료·문화 콘텐츠 수출 기업이 재차 상승할 것이라고 내다봤다. 국가별로 보면 밸류 부담이 커진 미국 증시보다 적극적 경기부양책이 기대되는 중국을 대안으로 제시했다. 김병연 NH투자증권 연구원은 “2025년에 필요한 것은 뱀의 감각”이라며 “비싸지면 과감히 차익실현에 나서고, 싸지면 비중을 높여야 한다”고 했다.삼성증권은 빈틈을 파고드는 테마 업종 투자도 고려해야 한다고 했다. 양 연구원은 “암호화폐 가격 상승으로 암호화폐 주 이용자인 30~40대 남성 중심의 소비 테마가 활황을 보일 수 있다”며 “베이비부머 세대가 은퇴를 앞두면서 관련 상품 역시 눈여겨봐야 한다”고 했다.미래에셋증권은 수출 증가 모멘텀이 지속되는 업종이 내년에도 강세를 이어갈 것이라고 예상했다. 특히 방산·조선·전력기기 등 한국 업체들이 ‘대체 불가’하다고 평가받는 만큼 전반적인 수출 경기 둔화에도 대처할 수 있다는 분석이다. 유명간 미래에셋증권 연구원은 “조선 업종은 작년 3개 분기 연속 컨센서스(증권사 추정치 평균)를 웃돌며 매출 증가에 대한 투자자들의 믿음이 커졌다”며 “전력기기 업종은 수요가 확대되는데 공급은 모자란 상황이 지속돼 성장이 이어질 것”이라고 했다.배태웅 기자 btu104@hankyung.com
                                    ",2025.01.07 16:19,23,2252,4,463,상저 코스피 하반기,한경 푸른 뱀 해 인 을사년 이 국내 증시 상황 안갯속 작년 상반기 선방 증시 하반기 도널드 트럼프 미국 대통령 당선인 승리 국내 정치 불안 기업 실적 둔화 겹치 흐름 증권 상반기 변동성 증시 하반기 안정 상 저하 를 것 예상 전문가 변동성 해 대처 뱀 투자 전략 고 을사년 코스피 상 저하 전망 금융투자 업계 국내 증권사 곳 전망 코스피지수 연간 변동 폭 평균 사이 것 집계 작년 말 코스피지수 종가 비교 최대 수 것 증권사 별로 증권 코스피지수 상단 가장 제시 이 투자 증권 증권 대신 증권 등 비교 제시 가장 상단 제시 곳 증권 다수 증권사 올해 코스피지수 상반기 흐름 하반기 등세 것 예상 트럼프 당선인 모든 수입품 수준 관세 매기 보편 관세 시행 물가 상승 글로벌 경제 악 영향 하반기 영향 것 관측 긍정 전망 근거 국내 증시 극단 평가 외국인 자금 및 대기 자금 재 유입 가능성 코스피지수 개월 후행 주가 자산 비율 은 지난 기준 배 통상 평가 기준 배 크게 밑 외국인 도세 증시 저가 매력 부각 최근 작년 달 국내 증시 외국인 도세 이후 매월 둔화 개인 투자자 증시 자금 새해 증가 투자자 탁 금은 작년 말 대비 김성 노 투자 증권 연구원 트럼프 정부 보편 관세 영향 세계 경제 상반기 하반기 상승세 것 라며 한국 경제성장률 내년 점 완만 회복 세 것 양일 삼성 증권 연구원 트럼프 정부 정책 가시 미국 소득세 법인세 인하 에너지 생산 확대 통한 물가 완화 오히려 글로벌 증시 긍정 영향 줄 수도 고 김대준 한국 투자 증권 연구원 통화 완화 정책 지속 경제 전반 금리 효과 수 며 지수 투자 경우 저가 매수 시기 고 뱀 전략 전문가 올해 증시 변동성 확대 대비 전략 입 투자 증권 상반기 오히려 저가 매수 기회 일 수 조언 업종 별로 하반기 낙폭 푸드 드라마 등 식 음료 문화 콘텐츠 수출 기업 재차 상승 것 국가 별로 밸류 부담 미국 증시 적극 부양책 기대 중국 대안 제시 김병연 투자 증권 연구원 것 뱀 감각 라며 과 감히 차익 실현 비중 고 증권 빈틈 테마 업종 투자 고려 양 연구원 암호 화폐 가격 상승 암호 화폐 주 이용자 남성 중심 소비 테마 활황 수 며 베이비부머 세대 은퇴 관련 상품 역시 눈 고 미래에셋 증권 수출 증가 모멘텀 지속 업종 내년 강세 것 예상 방산 조선 전력 기기 등 한국 업체 대체 불가 평가 만큼 전반 수출 경기 둔화 대처 수 분석 유명 미래에셋 증권 연구원 조선 업종 작년 개 분기 연속 컨센서스 증권사 추 정치 평균 를 웃돌 매출 증가 대한 투자자 믿음 며 전력 기기 업종 수요 확대 공급 상황 지속 성장 것 배 태웅 기자
